Nom de l'Entreprise,SIREN,Forme Juridique,Capital Social,Date de Création,Effectifs,Code NAF,Siège Social,Chiffre d'Affaires 2023,Résultat Net 2023,Dirigeant Principal,Contact Principal,Position,Email,Téléphone,Adresse,Secteur,Dernière Interaction,Prochaine Étape
TechnoDynamic,123 456 789,SAS,1 000 000 €,15/03/2010,250,6202A,"15 Rue de l'Innovation, 75000 Paris, France",30 000 000 €,4 500 000 €,"Marc Dubois, Président",Julien Moreau,Directeur des Opérations,j.moreau@technodynamic.com,+33 1 23 45 67 89,"15 Rue de l'Innovation, Paris, France",Manufacturier,10/01/2024 - Présentation du nouveau logiciel de gestion de la chaîne d'approvisionnement,Rendez-vous le 20/01/2024 pour démonstration technique
DataSolutions,987 654 321,SARL,500 000 €,22/07/2015,150,6201Z,"88 Avenue du Numérique, 69000 Lyon, France",20 000 000 €,3 000 000 €,"Émilie Rousseau, Gérante",Amélie Petit,CTO,a.petit@datasolutions.fr,+33 1 98 76 54 32,"88 Avenue du Numérique, Lyon, France",Technologie Financière,05/01/2024 - Discussion sur les besoins en sécurité informatique,Envoyer une proposition commerciale le 15/01/2024
GreenTech Innovations,456 123 789,SA,2 000 000 €,05/11/2012,300,7112B,"32 Rue des Énergies Renouvelables, 34000 Montpellier, France",35 000 000 €,5 000 000 €,"Alexandre Martin, PDG",Lucas Dupont,Responsable R&D,l.dupont@greentechinnov.fr,+33 4 67 89 01 23,"32 Rue des Énergies Renouvelables, Montpellier, France",Énergies Vertes,20/12/2023 - Présentation sur l'intégration des systèmes de gestion énergétique,Suivi le 25/01/2024 pour évaluation du projet pilote
MedicoSoft,321 654 987,SASU,750 000 €,17/04/2017,100,6202B,"47 Boulevard de la Santé, 44000 Nantes, France",15 000 000 €,2 200 000 €,"Julie Fontaine, Présidente",Claire Bernard,CEO,c.bernard@medicosoft.com,+33 2 54 76 98 77,"47 Boulevard de la Santé, Nantes, France",Santé et Biotechnologie,02/01/2024 - Webinaire sur les solutions logicielles pour les hôpitaux,Proposition de partenariat le 30/01/2024
EduNet Services,789 321 456,EURL,300 000 €,03/09/2013,80,8559A,"12 Rue de l'Éducation, 67000 Strasbourg, France",10 000 000 €,1 500 000 €,"Sophie Lemoine, Directrice",Sophie Lemoine,Directrice des Achats,s.lemoine@edunetservices.fr,+33 3 21 34 56 78,"12 Rue de l'Éducation, Strasbourg, France",Éducation et Formation,15/01/2024 - Réunion pour la mise à jour du système informatique éducatif,Présentation de la nouvelle plateforme e-learning le 05/02/2024
